{
  "$schema": "https://json-schema.org/draft/2020-12/schema",
  "$id": "https://raw.githubusercontent.com/tooszovski/apex-tracks/main/schema/track.schema.json",
  "title": "Apex track layout",
  "description": "One layout of one race track: timing lines, corners and the driven line. Mirrors the Track model of the Apex app (formatVersion 1).",
  "type": "object",
  "additionalProperties": false,
  "required": [
    "formatVersion", "id", "slug", "name", "country", "center", "startFinish", "sectors", "corners",
    "outline", "surface", "lengthM", "source", "author", "license", "updated"
  ],
  "properties": {
    "$schema": { "type": "string" },
    "formatVersion": { "const": 1 },
    "example": {
      "description": "Synthetic sample for docs and tests. Allowed only under tracks/_example/, never in the index.",
      "type": "boolean"
    },
    "id": {
      "description": "Stable UUID of the layout. Never changes once merged; the app matches its own copy of the track by it.",
      "type": "string",
      "pattern": "^[0-9a-fA-F]{8}-[0-9a-fA-F]{4}-[0-9a-fA-F]{4}-[0-9a-fA-F]{4}-[0-9a-fA-F]{12}$"
    },
    "slug": {
      "description": "Latin kebab-case, equal to the file name without .json. Layouts of one place share a prefix: igora-drive, igora-drive-short.",
      "type": "string",
      "pattern": "^[a-z0-9]+(-[a-z0-9]+)*$",
      "maxLength": 64
    },
    "name": {
      "description": "Official name in Latin script, layout included: \"Igora Drive — Full\".",
      "type": "string", "minLength": 2, "maxLength": 120
    },
    "localName": {
      "description": "Name in the local language and script (e.g. Cyrillic for a Russian track).",
      "type": "string", "minLength": 2, "maxLength": 120
    },
    "country": {
      "description": "ISO 3166-1 alpha-2, upper case; the directory is the same code in lower case.",
      "type": "string", "pattern": "^[A-Z]{2}$"
    },
    "city": { "description": "Nearest town, region.", "type": "string", "maxLength": 120 },
    "center": { "$ref": "#/$defs/geoPoint", "description": "Middle of the track, used to find tracks near the driver." },
    "startFinish": { "$ref": "#/$defs/gate", "description": "Start line; also the finish on a circuit." },
    "finish": {
      "$ref": "#/$defs/gate",
      "description": "Separate finish line (point-to-point: hill climb, sprint). Absent — a circuit, laps end at the start line."
    },
    "sectors": {
      "description": "Sector split lines in lap order (start/finish excluded).",
      "type": "array", "maxItems": 20,
      "items": { "$ref": "#/$defs/gate" }
    },
    "corners": {
      "description": "Corners in lap order, numbered as on the official map when there is one.",
      "type": "array", "maxItems": 60,
      "items": { "$ref": "#/$defs/corner" }
    },
    "outline": {
      "description": "The driven line of one clean lap, in the direction of travel. A circuit closes on itself.",
      "type": "array", "minItems": 20, "maxItems": 2000,
      "items": { "$ref": "#/$defs/geoPoint" }
    },
    "surface": { "enum": ["asphalt", "gravel", "snow", "ice"] },
    "lengthM": { "description": "Lap (or run) length along the outline, metres.", "type": "number", "minimum": 200, "maximum": 30000 },
    "direction": {
      "description": "Circuits: clockwise or counter-clockwise seen from above.",
      "enum": ["cw", "ccw"]
    },
    "variantOf": {
      "description": "Slug of the main layout of the same place, when this is another layout of it.",
      "type": "string", "pattern": "^[a-z0-9]+(-[a-z0-9]+)*$"
    },
    "source": { "$ref": "#/$defs/source", "description": "Where the lines, corners and outline come from." },
    "outlineSource": {
      "$ref": "#/$defs/source",
      "description": "Only when the outline comes from elsewhere than the rest (e.g. OpenStreetMap)."
    },
    "license": {
      "description": "MIT for own work; ODbL-1.0 when anything in the file is derived from OpenStreetMap.",
      "enum": ["MIT", "ODbL-1.0"]
    },
    "author": { "$ref": "#/$defs/githubHandle", "description": "GitHub handle of who marked the track." },
    "contributors": {
      "description": "GitHub handles of who corrected it later.",
      "type": "array", "uniqueItems": true,
      "items": { "$ref": "#/$defs/githubHandle" }
    },
    "raceChronoID": {
      "description": "The track's number in RaceChrono's online library, as a cross-reference only (no data from it).",
      "type": "integer", "minimum": 1
    },
    "notes": { "type": "string", "maxLength": 2000 },
    "updated": {
      "description": "Date of the last change of the markup, YYYY-MM-DD.",
      "type": "string", "pattern": "^20[0-9]{2}-(0[1-9]|1[0-2])-(0[1-9]|[12][0-9]|3[01])$"
    }
  },
  "if": { "not": { "required": ["finish"] } },
  "then": { "required": ["direction"] },
  "$defs": {
    "geoPoint": {
      "description": "WGS 84, decimal degrees, at least 6 decimals.",
      "type": "object",
      "additionalProperties": false,
      "required": ["lat", "lon"],
      "properties": {
        "lat": { "type": "number", "minimum": -90, "maximum": 90 },
        "lon": { "type": "number", "minimum": -180, "maximum": 180 }
      }
    },
    "gate": {
      "description": "A timing line: its middle, the direction of travel across it and its full width.",
      "type": "object",
      "additionalProperties": false,
      "required": ["point", "heading", "width"],
      "properties": {
        "point": { "$ref": "#/$defs/geoPoint" },
        "heading": { "description": "Compass bearing of travel, degrees: 0 north, 90 east.", "type": "number", "minimum": 0, "exclusiveMaximum": 360 },
        "width": { "description": "Full width, metres.", "type": "number", "minimum": 5, "maximum": 80 }
      }
    },
    "corner": {
      "type": "object",
      "additionalProperties": false,
      "required": ["number", "direction", "apex"],
      "properties": {
        "number": { "type": "integer", "minimum": 1 },
        "name": { "description": "Official or common name: \"Mobil 1\", \"Karussell\".", "type": "string", "maxLength": 60 },
        "direction": { "enum": ["left", "right"] },
        "apex": { "$ref": "#/$defs/geoPoint" },
        "entry": { "$ref": "#/$defs/geoPoint", "description": "Turn-in point, optional." }
      }
    },
    "source": {
      "type": "object",
      "additionalProperties": false,
      "required": ["kind", "details"],
      "properties": {
        "kind": { "enum": ["own-gps", "survey", "osm", "other"] },
        "details": { "description": "What exactly: receiver and date of the lap, way ids, how it was checked.", "type": "string", "minLength": 3, "maxLength": 1000 },
        "attribution": { "description": "Required for osm: \"© OpenStreetMap contributors\".", "type": "string" },
        "url": { "type": "string", "format": "uri" }
      }
    },
    "githubHandle": { "type": "string", "pattern": "^[A-Za-z0-9](?:[A-Za-z0-9]|-(?=[A-Za-z0-9])){0,38}$" }
  }
}
