{
  "$schema": "../../schema/track.schema.json",
  "formatVersion": 1,
  "example": true,
  "id": "00000000-0000-4000-8000-000000000001",
  "slug": "example-circuit",
  "name": "Example Circuit (synthetic)",
  "localName": "Example Circuit",
  "country": "ZZ",
  "city": "Nowhere, South Pacific",
  "center": {"lat": -48.000000, "lon": -123.000000},
  "startFinish": {
    "point": {"lat": -47.9980401, "lon": -123.0027208},
    "heading": 13.1,
    "width": 30
  },
  "sectors": [
    {
      "point": {"lat": -47.9997583, "lon": -122.9950918},
      "heading": 149,
      "width": 30
    },
    {
      "point": {"lat": -48.0031731, "lon": -123.0029595},
      "heading": 268.4,
      "width": 30
    }
  ],
  "corners": [
    {
      "number": 1,
      "name": "First",
      "direction": "right",
      "apex": {"lat": -47.9958174, "lon": -122.9997316},
      "entry": {"lat": -47.9959166, "lon": -123.0005219}
    },
    {
      "number": 2,
      "direction": "right",
      "apex": {"lat": -48.0018916, "lon": -122.9948396},
      "entry": {"lat": -48.0013898, "lon": -122.9945496}
    },
    {
      "number": 3,
      "name": "Hairpin",
      "direction": "left",
      "apex": {"lat": -48.0026364, "lon": -122.9997058},
      "entry": {"lat": -48.0026585, "lon": -122.9989004}
    },
    {
      "number": 4,
      "direction": "right",
      "apex": {"lat": -48.0023113, "lon": -123.0056141},
      "entry": {"lat": -48.0027209, "lon": -123.0050929}
    },
    {
      "number": 5,
      "direction": "left",
      "apex": {"lat": -47.9987549, "lon": -123.0031108},
      "entry": {"lat": -47.9991362, "lon": -123.0036791}
    }
  ],
  "outline": [
    {"lat": -47.9980401, "lon": -123.0027208},
    {"lat": -47.9979963, "lon": -123.0027055},
    {"lat": -47.9979524, "lon": -123.0026902},
    {"lat": -47.9979086, "lon": -123.0026747},
    {"lat": -47.9978648, "lon": -123.002659},
    {"lat": -47.997821, "lon": -123.002643},
    {"lat": -47.9977774, "lon": -123.0026266},
    {"lat": -47.9977337, "lon": -123.0026099},
    {"lat": -47.9976902, "lon": -123.0025927},
    {"lat": -47.9976467, "lon": -123.002575},
    {"lat": -47.9976034, "lon": -123.0025567},
    {"lat": -47.9975602, "lon": -123.0025378},
    {"lat": -47.997517, "lon": -123.0025183},
    {"lat": -47.9974741, "lon": -123.0024981},
    {"lat": -47.9974313, "lon": -123.0024773},
    {"lat": -47.9973886, "lon": -123.0024557},
    {"lat": -47.9973461, "lon": -123.0024333},
    {"lat": -47.9973038, "lon": -123.0024102},
    {"lat": -47.9972617, "lon": -123.0023862},
    {"lat": -47.9972198, "lon": -123.0023614},
    {"lat": -47.9971782, "lon": -123.0023358},
    {"lat": -47.9971368, "lon": -123.0023093},
    {"lat": -47.9970956, "lon": -123.0022819},
    {"lat": -47.9970548, "lon": -123.0022536},
    {"lat": -47.9970142, "lon": -123.0022244},
    {"lat": -47.9969739, "lon": -123.0021943},
    {"lat": -47.996934, "lon": -123.0021632},
    {"lat": -47.9968944, "lon": -123.0021312},
    {"lat": -47.9968551, "lon": -123.0020982},
    {"lat": -47.9968162, "lon": -123.0020642},
    {"lat": -47.9967777, "lon": -123.0020293},
    {"lat": -47.9967397, "lon": -123.0019933},
    {"lat": -47.996702, "lon": -123.0019563},
    {"lat": -47.9966648, "lon": -123.0019184},
    {"lat": -47.9966281, "lon": -123.0018794},
    {"lat": -47.9965919, "lon": -123.0018394},
    {"lat": -47.9965562, "lon": -123.0017983},
    {"lat": -47.996521, "lon": -123.0017563},
    {"lat": -47.9964864, "lon": -123.0017132},
    {"lat": -47.9964524, "lon": -123.0016691},
    {"lat": -47.996419, "lon": -123.001624},
    {"lat": -47.9963862, "lon": -123.0015778},
    {"lat": -47.996354, "lon": -123.0015307},
    {"lat": -47.9963226, "lon": -123.0014825},
    {"lat": -47.9962918, "lon": -123.0014333},
    {"lat": -47.9962618, "lon": -123.0013831},
    {"lat": -47.9962325, "lon": -123.001332},
    {"lat": -47.996204, "lon": -123.0012798},
    {"lat": -47.9961764, "lon": -123.0012267},
    {"lat": -47.9961495, "lon": -123.0011727},
    {"lat": -47.9961235, "lon": -123.0011177},
    {"lat": -47.9960984, "lon": -123.0010618},
    {"lat": -47.9960742, "lon": -123.0010051},
    {"lat": -47.996051, "lon": -123.0009474},
    {"lat": -47.9960287, "lon": -123.0008889},
    {"lat": -47.9960074, "lon": -123.0008296},
    {"lat": -47.9959871, "lon": -123.0007695},
    {"lat": -47.9959679, "lon": -123.0007087},
    {"lat": -47.9959497, "lon": -123.0006471},
    {"lat": -47.9959326, "lon": -123.0005848},
    {"lat": -47.9959166, "lon": -123.0005219},
    {"lat": -47.9959017, "lon": -123.0004584},
    {"lat": -47.995888, "lon": -123.0003942},
    {"lat": -47.9958754, "lon": -123.0003296},
    {"lat": -47.9958641, "lon": -123.0002645},
    {"lat": -47.9958539, "lon": -123.0001989},
    {"lat": -47.995845, "lon": -123.0001329},
    {"lat": -47.9958372, "lon": -123.0000666},
    {"lat": -47.9958308, "lon": -123.000000},
    {"lat": -47.9958255, "lon": -122.9999331},
    {"lat": -47.9958215, "lon": -122.9998661},
    {"lat": -47.9958188, "lon": -122.9997989},
    {"lat": -47.9958174, "lon": -122.9997316},
    {"lat": -47.9958172, "lon": -122.9996643},
    {"lat": -47.9958183, "lon": -122.999597},
    {"lat": -47.9958207, "lon": -122.9995298},
    {"lat": -47.9958243, "lon": -122.9994627},
    {"lat": -47.9958292, "lon": -122.9993958},
    {"lat": -47.9958353, "lon": -122.9993291},
    {"lat": -47.9958426, "lon": -122.9992627},
    {"lat": -47.9958512, "lon": -122.9991966},
    {"lat": -47.995861, "lon": -122.9991309},
    {"lat": -47.995872, "lon": -122.9990657},
    {"lat": -47.9958842, "lon": -122.9990009},
    {"lat": -47.9958975, "lon": -122.9989366},
    {"lat": -47.995912, "lon": -122.9988728},
    {"lat": -47.9959276, "lon": -122.9988097},
    {"lat": -47.9959443, "lon": -122.9987472},
    {"lat": -47.9959621, "lon": -122.9986853},
    {"lat": -47.9959809, "lon": -122.9986242},
    {"lat": -47.9960008, "lon": -122.9985638},
    {"lat": -47.9960217, "lon": -122.9985042},
    {"lat": -47.9960436, "lon": -122.9984453},
    {"lat": -47.9960664, "lon": -122.9983873},
    {"lat": -47.9960901, "lon": -122.9983301},
    {"lat": -47.9961147, "lon": -122.9982737},
    {"lat": -47.9961403, "lon": -122.9982183},
    {"lat": -47.9961666, "lon": -122.9981637},
    {"lat": -47.9961938, "lon": -122.998110},
    {"lat": -47.9962218, "lon": -122.9980573},
    {"lat": -47.9962506, "lon": -122.9980055},
    {"lat": -47.9962801, "lon": -122.9979546},
    {"lat": -47.9963103, "lon": -122.9979047},
    {"lat": -47.9963412, "lon": -122.9978558},
    {"lat": -47.9963728, "lon": -122.9978078},
    {"lat": -47.996405, "lon": -122.9977608},
    {"lat": -47.9964379, "lon": -122.9977147},
    {"lat": -47.9964713, "lon": -122.9976696},
    {"lat": -47.9965053, "lon": -122.9976255},
    {"lat": -47.9965399, "lon": -122.9975823},
    {"lat": -47.996575, "lon": -122.9975402},
    {"lat": -47.9966106, "lon": -122.9974989},
    {"lat": -47.9966467, "lon": -122.9974586},
    {"lat": -47.9966832, "lon": -122.9974193},
    {"lat": -47.9967202, "lon": -122.9973808},
    {"lat": -47.9967576, "lon": -122.9973434},
    {"lat": -47.9967954, "lon": -122.9973068},
    {"lat": -47.9968336, "lon": -122.9972711},
    {"lat": -47.9968722, "lon": -122.9972363},
    {"lat": -47.9969111, "lon": -122.9972024},
    {"lat": -47.9969503, "lon": -122.9971693},
    {"lat": -47.9969898, "lon": -122.9971371},
    {"lat": -47.9970297, "lon": -122.9971057},
    {"lat": -47.9970698, "lon": -122.9970751},
    {"lat": -47.9971102, "lon": -122.9970453},
    {"lat": -47.9971508, "lon": -122.9970163},
    {"lat": -47.9971917, "lon": -122.996988},
    {"lat": -47.9972328, "lon": -122.9969604},
    {"lat": -47.9972741, "lon": -122.9969336},
    {"lat": -47.9973156, "lon": -122.9969074},
    {"lat": -47.9973573, "lon": -122.9968818},
    {"lat": -47.9973991, "lon": -122.9968569},
    {"lat": -47.9974411, "lon": -122.9968325},
    {"lat": -47.9974832, "lon": -122.9968087},
    {"lat": -47.9975255, "lon": -122.9967854},
    {"lat": -47.9975678, "lon": -122.9967626},
    {"lat": -47.9976103, "lon": -122.9967402},
    {"lat": -47.9976529, "lon": -122.9967182},
    {"lat": -47.9976955, "lon": -122.9966966},
    {"lat": -47.9977383, "lon": -122.9966753},
    {"lat": -47.997781, "lon": -122.9966542},
    {"lat": -47.9978239, "lon": -122.9966333},
    {"lat": -47.9978667, "lon": -122.9966126},
    {"lat": -47.9979096, "lon": -122.996592},
    {"lat": -47.9979525, "lon": -122.9965714},
    {"lat": -47.9979953, "lon": -122.9965507},
    {"lat": -47.9980382, "lon": -122.996530},
    {"lat": -47.998081, "lon": -122.996509},
    {"lat": -47.9981237, "lon": -122.9964879},
    {"lat": -47.9981664, "lon": -122.9964664},
    {"lat": -47.998209, "lon": -122.9964445},
    {"lat": -47.9982515, "lon": -122.9964222},
    {"lat": -47.9982939, "lon": -122.9963993},
    {"lat": -47.9983361, "lon": -122.9963758},
    {"lat": -47.9983781, "lon": -122.9963516},
    {"lat": -47.9984199, "lon": -122.9963267},
    {"lat": -47.9984616, "lon": -122.9963009},
    {"lat": -47.9985029, "lon": -122.9962744},
    {"lat": -47.9985441, "lon": -122.9962469},
    {"lat": -47.9985849, "lon": -122.9962185},
    {"lat": -47.9986254, "lon": -122.9961891},
    {"lat": -47.9986657, "lon": -122.9961589},
    {"lat": -47.9987056, "lon": -122.9961276},
    {"lat": -47.9987451, "lon": -122.9960955},
    {"lat": -47.9987844, "lon": -122.9960625},
    {"lat": -47.9988233, "lon": -122.9960286},
    {"lat": -47.9988619, "lon": -122.995994},
    {"lat": -47.9989002, "lon": -122.9959586},
    {"lat": -47.9989383, "lon": -122.9959225},
    {"lat": -47.998976, "lon": -122.9958858},
    {"lat": -47.9990136, "lon": -122.9958486},
    {"lat": -47.9990509, "lon": -122.9958109},
    {"lat": -47.999088, "lon": -122.9957729},
    {"lat": -47.999125, "lon": -122.9957345},
    {"lat": -47.9991619, "lon": -122.9956958},
    {"lat": -47.9991987, "lon": -122.995657},
    {"lat": -47.9992354, "lon": -122.9956181},
    {"lat": -47.9992722, "lon": -122.9955791},